{
 "format": "expectrail.discovery-run/v1",
 "runId": "local-reported",
 "mode": "discover",
 "evidenceLabel": "FRESH LIVE",
 "contextManifest": {
  "condition": "development-reproduction",
  "supplied": [
   "mechanics profile (claims read from the clean game's code and settings)",
   "generic probe library",
   "per-probe signal summaries of the base snapshots (planner only)"
  ],
  "withheld": [
   "bug reports",
   "patches and diffs",
   "the reported bugs' routes",
   "the hand-written trace rules and guards of the reported-bug bench"
  ]
 },
 "profile": {
  "id": "godot-platformer",
  "sha256": "7ad60a7ddc662fab9bcade5b743a34278a3b1a3f14af59a23f6e38a902fe65ec"
 },
 "snapshots": [
  {
   "name": "clean",
   "role": "reference",
   "patchSha256": null,
   "treeSha256": "6a273587d64e10a74c0160256cfdc4964f16ed3e93fe7ab178e1bedc5071b280"
  },
  {
   "name": "air-jump",
   "role": "base",
   "patchSha256": "a38199518d3070e8fa0b16060fcfff51e43a359ffc0167824d8cdf18e0061679",
   "treeSha256": "6a273587d64e10a74c0160256cfdc4964f16ed3e93fe7ab178e1bedc5071b280"
  },
  {
   "name": "gun-cooldown",
   "role": "base",
   "patchSha256": "df744001c53910625c520667e40bd7465de5ff026fc9e22420aefb50795fa6cf",
   "treeSha256": "6a273587d64e10a74c0160256cfdc4964f16ed3e93fe7ab178e1bedc5071b280"
  },
  {
   "name": "body-flip",
   "role": "base",
   "patchSha256": "52dcc966811716720fc6d3648c58b52aa7a646c975c0ffe788a5fc9c76eb526a",
   "treeSha256": "6a273587d64e10a74c0160256cfdc4964f16ed3e93fe7ab178e1bedc5071b280"
  },
  {
   "name": "enemy-ledge",
   "role": "base",
   "patchSha256": "644ad443ede20eea4630f2e5aa85e8ef20123e46dd1418289eb928aebbfdd856",
   "treeSha256": "6a273587d64e10a74c0160256cfdc4964f16ed3e93fe7ab178e1bedc5071b280"
  }
 ],
 "stages": [
  {
   "name": "library probes",
   "status": "complete",
   "detail": "22 probes on 5 snapshots"
  },
  {
   "name": "planner",
   "status": "skipped",
   "detail": "no planner configured"
  },
  {
   "name": "reference check",
   "status": "complete",
   "detail": "0 contracts fail on the healthy reference and are rejected"
  },
  {
   "name": "reproduction",
   "status": "complete",
   "detail": "12 findings, each replayed up to 3 times"
  }
 ],
 "probes": [
  {
   "id": "wait-long",
   "family": "wait",
   "source": "library",
   "routeSha256": "0746f1753d65ce9bcd3ae28a70802c951b87c8e10c9b213f3bff1f08d9be29cd",
   "ticks": 1150
  },
  {
   "id": "hold-right",
   "family": "hold",
   "source": "library",
   "routeSha256": "9c1617e416ffef6b94643a19acd53d5596a014f46ba65910426bd1d4d93a87c6",
   "ticks": 340
  },
  {
   "id": "hold-left",
   "family": "hold",
   "source": "library",
   "routeSha256": "d0c42842b6ce4ddb5fd2ac8a72672ca4c72e2645519c037658c98696ee438dba",
   "ticks": 340
  },
  {
   "id": "reverse",
   "family": "reverse",
   "source": "library",
   "routeSha256": "d449b338f6c7efcc184c1a9140941d7e77047f0e98271125127b191f1c29ef80",
   "ticks": 340
  },
  {
   "id": "jump-w0-x1",
   "family": "jump-taps",
   "source": "library",
   "routeSha256": "05fbc284b8bda5425ab338a4ef235d9c07ccd95caeb2782fb017c5119a4596cf",
   "ticks": 100
  },
  {
   "id": "jump-w0-x2",
   "family": "jump-taps",
   "source": "library",
   "routeSha256": "b6cca17fb249a7685d9b7a1d01ed02e04251c0b1c343f96c145c5f6001bfe128",
   "ticks": 120
  },
  {
   "id": "jump-w0-x8",
   "family": "jump-taps",
   "source": "library",
   "routeSha256": "209cf72abe2851ee92b765d6cbb4fcda1bc032bebd259b7aa5de64e5e3500293",
   "ticks": 240
  },
  {
   "id": "jump-w40-x1",
   "family": "jump-taps",
   "source": "library",
   "routeSha256": "67f3bdeec4fc32f4f42bb8e19138917a0c5e84cc54c762fce78172e34341a325",
   "ticks": 140
  },
  {
   "id": "jump-w40-x2",
   "family": "jump-taps",
   "source": "library",
   "routeSha256": "742850d7ab0d04de56d1aa2e23ac9c56bb3b725f8ada293947ef4c4aa4b65d79",
   "ticks": 160
  },
  {
   "id": "jump-w40-x8",
   "family": "jump-taps",
   "source": "library",
   "routeSha256": "bb8ffadfe5b02a47813a5e3a1949e9a3421342a0f92ef63c3a26c6f118a72778",
   "ticks": 280
  },
  {
   "id": "jump-w80-x1",
   "family": "jump-taps",
   "source": "library",
   "routeSha256": "03727ff8e274f7ca53064faf0820a5853a6be5b88c62072f259a135268d5f8e9",
   "ticks": 180
  },
  {
   "id": "jump-w80-x2",
   "family": "jump-taps",
   "source": "library",
   "routeSha256": "36e5b2628fb9e3b554277bc9ff2e5a70d38f09428572a8a70f5c2c5a76bb7995",
   "ticks": 200
  },
  {
   "id": "jump-w80-x8",
   "family": "jump-taps",
   "source": "library",
   "routeSha256": "2a9eb2a3cd276d5c259f8ac3a36489647ea9dd6930dc5d39a243e21f79737d5a",
   "ticks": 320
  },
  {
   "id": "jump-w120-x1",
   "family": "jump-taps",
   "source": "library",
   "routeSha256": "5e5434d594ddd3715569bc6381489a08c7a382599a98f56b045b8a626998b13f",
   "ticks": 220
  },
  {
   "id": "jump-w120-x2",
   "family": "jump-taps",
   "source": "library",
   "routeSha256": "ca4d763028dcf7ef8d83a47cfef24a0fae3ef5db138e215b070156bae5c5849a",
   "ticks": 240
  },
  {
   "id": "jump-w120-x8",
   "family": "jump-taps",
   "source": "library",
   "routeSha256": "a227fc1afba206f0f9cedc3df7965af5d25059d29bdfb5d14a0bcd927ca13063",
   "ticks": 360
  },
  {
   "id": "shoot-right-every48",
   "family": "shoot-rate",
   "source": "library",
   "routeSha256": "a294d061444e538ee9b0eb58eb71995e96df89f223edb44a7440f45f12879034",
   "ticks": 234
  },
  {
   "id": "shoot-right-every12",
   "family": "shoot-rate",
   "source": "library",
   "routeSha256": "e774115a4ccb465aa723e31e0bd4711fab5f5ad0553f9c6633ffdf05cee85dae",
   "ticks": 234
  },
  {
   "id": "shoot-left-every48",
   "family": "shoot-rate",
   "source": "library",
   "routeSha256": "f657f374af462f695bf01fa6a9e77fbe5d2a9a5d932f395aed17e729025bd1cf",
   "ticks": 246
  },
  {
   "id": "shoot-left-every12",
   "family": "shoot-rate",
   "source": "library",
   "routeSha256": "e0742f3a18c47208c93e0d0ce97ce163daf65b44faff41efe7f811d0de0df6fe",
   "ticks": 246
  },
  {
   "id": "move-fire-right",
   "family": "move-and-fire",
   "source": "library",
   "routeSha256": "fadad3101620ee5b4bd6929af6d35e1ad44eccf2aa5246b938b10b761984b409",
   "ticks": 316
  },
  {
   "id": "move-fire-left",
   "family": "move-and-fire",
   "source": "library",
   "routeSha256": "4181e355f218f08f9a46dade50e9f044aa3c6159d8c436206ea18696b23e0f03",
   "ticks": 316
  }
 ],
 "verdicts": [
  {
   "snapshot": "clean",
   "specId": "jump-max-rise",
   "probeIds": [
    "wait-long"
   ],
   "result": "not_exercised",
   "triggeredCount": 0,
   "evaluatedCount": 0
  },
  {
   "snapshot": "clean",
   "specId": "jump-max-rise",
   "probeIds": [
    "hold-right"
   ],
   "result": "not_exercised",
   "triggeredCount": 0,
   "evaluatedCount": 0
  },
  {
   "snapshot": "clean",
   "specId": "jump-max-rise",
   "probeIds": [
    "hold-left"
   ],
   "result": "not_exercised",
   "triggeredCount": 0,
   "evaluatedCount": 0
  },
  {
   "snapshot": "clean",
   "specId": "jump-max-rise",
   "probeIds": [
    "reverse"
   ],
   "result": "not_exercised",
   "triggeredCount": 0,
   "evaluatedCount": 0
  },
  {
   "snapshot": "clean",
   "specId": "jump-max-rise",
   "probeIds": [
    "jump-w0-x1"
   ],
   "result": "pass",
   "triggeredCount": 1,
   "evaluatedCount": 1
  },
  {
   "snapshot": "clean",
   "specId": "jump-max-rise",
   "probeIds": [
    "jump-w0-x2"
   ],
   "result": "pass",
   "triggeredCount": 1,
   "evaluatedCount": 1
  },
  {
   "snapshot": "clean",
   "specId": "jump-max-rise",
   "probeIds": [
    "jump-w0-x8"
   ],
   "result": "pass",
   "triggeredCount": 2,
   "evaluatedCount": 2
  },
  {
   "snapshot": "clean",
   "specId": "jump-max-rise",
   "probeIds": [
    "jump-w40-x1"
   ],
   "result": "pass",
   "triggeredCount": 1,
   "evaluatedCount": 1
  },
  {
   "snapshot": "clean",
   "specId": "jump-max-rise",
   "probeIds": [
    "jump-w40-x2"
   ],
   "result": "pass",
   "triggeredCount": 1,
   "evaluatedCount": 1
  },
  {
   "snapshot": "clean",
   "specId": "jump-max-rise",
   "probeIds": [
    "jump-w40-x8"
   ],
   "result": "pass",
   "triggeredCount": 2,
   "evaluatedCount": 2
  },
  {
   "snapshot": "clean",
   "specId": "jump-max-rise",
   "probeIds": [
    "jump-w80-x1"
   ],
   "result": "pass",
   "triggeredCount": 1,
   "evaluatedCount": 1
  },
  {
   "snapshot": "clean",
   "specId": "jump-max-rise",
   "probeIds": [
    "jump-w80-x2"
   ],
   "result": "pass",
   "triggeredCount": 1,
   "evaluatedCount": 1
  },
  {
   "snapshot": "clean",
   "specId": "jump-max-rise",
   "probeIds": [
    "jump-w80-x8"
   ],
   "result": "pass",
   "triggeredCount": 2,
   "evaluatedCount": 2
  },
  {
   "snapshot": "clean",
   "specId": "jump-max-rise",
   "probeIds": [
    "jump-w120-x1"
   ],
   "result": "pass",
   "triggeredCount": 1,
   "evaluatedCount": 1
  },
  {
   "snapshot": "clean",
   "specId": "jump-max-rise",
   "probeIds": [
    "jump-w120-x2"
   ],
   "result": "pass",
   "triggeredCount": 1,
   "evaluatedCount": 1
  },
  {
   "snapshot": "clean",
   "specId": "jump-max-rise",
   "probeIds": [
    "jump-w120-x8"
   ],
   "result": "pass",
   "triggeredCount": 3,
   "evaluatedCount": 3
  },
  {
   "snapshot": "clean",
   "specId": "jump-max-rise",
   "probeIds": [
    "shoot-right-every48"
   ],
   "result": "not_exercised",
   "triggeredCount": 0,
   "evaluatedCount": 0
  },
  {
   "snapshot": "clean",
   "specId": "jump-max-rise",
   "probeIds": [
    "shoot-right-every12"
   ],
   "result": "not_exercised",
   "triggeredCount": 0,
   "evaluatedCount": 0
  },
  {
   "snapshot": "clean",
   "specId": "jump-max-rise",
   "probeIds": [
    "shoot-left-every48"
   ],
   "result": "not_exercised",
   "triggeredCount": 0,
   "evaluatedCount": 0
  },
  {
   "snapshot": "clean",
   "specId": "jump-max-rise",
   "probeIds": [
    "shoot-left-every12"
   ],
   "result": "not_exercised",
   "triggeredCount": 0,
   "evaluatedCount": 0
  },
  {
   "snapshot": "clean",
   "specId": "jump-max-rise",
   "probeIds": [
    "move-fire-right"
   ],